Удлинитель рулетка ШВВП 2х07 5м колодка 3 гнезда,429
"Корзинка декоративная, полиэстер, 28см, 5 цветов",429
"BY В ГОСТЯХ У СКАЗКИ Чехол для одежды, 60х100см, спанбонд, ПЕВА, 2 дизайна",419
"BY Насадка для швабры из хлопка, вес 240 гр",419
"Батарейки щелочные, 2 шт, щелочная, тип C, BL, FORZA ""Alkaline""",363
"BY РЫЖИЙ Салфетка для сушки посуды из микрофибры, 38x50см, 210г/кв.м, 2 дизайна",321
"VETTA Дозатор для жидкого мыла ""Роттанг"", пластик, 7,5х17 см, 2 цвета",307
"VETTA Замок велосипедный противоугонный тросовый, металл, ПВХ, пластик, 12x1000мм",307
"VETTA Романо Кофр для белья на молнии с прозрачным окном, 35х30х20см, спанбонд, ПЕВА",223
"Вакуумный пакет VETTA с ароматом лаванды, 68х98 см",217
"VETTA Крючки самоклеящиеся, 5шт, 3,5см, нерж. сталь 430, 2 дизайна",203
"VETTA Корзинка универсальная ""Вилла"", 22x16x11см, пластик, 2 цвета",195
"VETTA Вешалка металл (сталь) с ПВХ покрытием 45см (цвет mix), TCH-101",181
"Лампа светодиодная FORZA A60, 12W, E27, 1050lm, 3000К",167
"Вакуумный пакет с клапаном VETTA, 50х70 см, работает от пылесоса",153
"Пакеты для замораживания перфорированные, 3 л, 18 мкм, 25х35 см, в рулоне 30 шт, GRIFON",139
"Термометр комнатный Цветок (0..+50) картон. блистер, П-1",139
"Лампа светодиодная FORZA G45, 7W, E14, 560lm, 4000К",111
"Салфетка для сантехники из микрофибры, 30х40 см, 3 цвета, VETTA",105
"Салфетка из микрофибры махровая Vetta, 30х40 см, цвет микс",105
"Салфетка универсальная из микрофибры Vetta, 30x40 см, цвет микс",97
"Шпагат полипропиленовый цветной, 100 м",97
"Лампа светодиодная FORZA G45, 7W, E27, 560lm, 4000К",79
"Салфетка универсальная из микрофибры, 30х30 см, 220 гр./кв.м, VETTA",69
"Крючки самоклеящиеся в пакете Vetta, 2 шт, цвета микс",63
"VETTA Сменные блоки для роликов 2шт, 20 листов, HQ0031*2 Дизайн GC",49
"VETTA Набор ковриков 2шт универсальных, полипропилен, 60х80см + 40х60см",1021
"VETTA Корзина для фруктов d21x13,3см, CWJ240B",881
"VETTA Полка угловая, металл, хром+белый, вакуумное крепление",741
"Удлинитель 3 гнезда FORZA 1 кв.мм 3 м, с заземлением, евро, 16A, 3500Вт",657
"VETTA Коврик для туалета, 50х50см, синель 1,2см, 3 цвета",657
"VETTA Щётка-смётка для удаления пыли, пластик, шерсть, молочный бамбук",601
"VETTA Сумка хозяйственная складная, 47x43см, до 20кг, полиэстер, 3 дизайна",559
"АКВАФОР Сменная кассета, В5",559
"Удлинитель 2 гнезда FORZA 0,75 кв.мм, 2 м, евророзетка, 6A, 1500Вт",391
"VETTA Сумка хозяйственная, 55х65х25см, 89 литров, до 7кг, полипропилен, 4 дизайна",391
"VETTA Мыльница ""Любовь с первого взгляда"", керамика, 2 цвета",279
"VETTA Сумка-авоська хозяйственная, 45х70см, 100% хлопок, 4 цвета",279
"VETTA Щётка для посуды пластик, молочный бамбук",251
ARTEX Крючок пятерной Slim арт.27 10 26,237
"VETTA Мыльница ""Палермо"", керамика, 3 цвета",209
"VETTA Пакет вакуумный с клапаном, 60х80см, 2 дизайна",209
"Лампа филаментная FORZA свеча, 4W, Е14, 390lm, 2800К",189
"Набор салфеток в рулоне из вискозы 30 шт, 23х30 см, VETTA",167
"Фольга пищевая 10 м в пленке, толщина 14 мкм, ""Прочная""",167
"VETTA Сумка хозяйственная, неламинированный пропилен, 60х37х26см, 55 литров, до 10кг",153
"Коврик в раковину противоскользящий, ПВХ, d. 29см, ""Паутинка""",153
"VETTA Ролик для чистки одежды + 2 сменных блока, 20 листов, HQ0030UN-B Дизайн GC",139
"VETTA Набор прищепок 12шт с силиконовыми держателями, ""Овал"", пластик 4 цвета",139
"Набор формочек для кап-кейков Vetta, 5,5х3х7 см, 48 шт",139
"Масло бытовое 125мл., RUNIS",133
"Набор решеток для раковины 2 шт - d. 6 см, 8 см,  нержавеющая сталь",125
"Щетка-утюжок универсальная, пластик, 20 см",119
"Лампа светодиодная FORZA A60, 6W, E27, 510lm, 3000K",111
"Лампа светодиодная FORZA G45, 7W, E14, 560lm, 3000К",111
"Лампа светодиодная FORZA G45, 5W, E27, 400lm, 4000К",111
"VETTA Фольга алюминиевая 29см х 10м, 9мкм, в пленке",89
"Мешки для мусора с завязками 50 л., 10 шт.,стандарт, желтые, рулон, герои",83
"Щетка хозяйственная универсальная Vetta, цвет микс",69
ФУКС Ложка для обуви металлическая цветная 20см,63
"VETTA Набор салфеток универсальных 5 шт., 25х25см, микрофибра",55
Лампа накаливания Б230/Т230-60Вт Е27,31
"VETTA Коврик универсальный, полиэстер, 120x70см, ""Пушистый"", 2 цвета",1526
"ARTEX Полка настенная двухъярусная с пласт.поддонами на самоклеящ.крючках, арт. 29.19.05",1246
"Крючки на планке, 5 шт, хром, вакуумное крепление, 393х40х133 мм, VETTA",839
"VETTA Коврик универсальный, флокированный ""Бархат"", резина, 75х45см, 3 дизайна",769
"VETTA Коврик для ванной фактурный, микрофибра, 50x80см, 2 цвета",769
"VETTA Шторка для ванной, таффета, метал. люверсы, 155x180см, ""Рио""",699
"VETTA Коврик придверный с ворсовой поверхностью 50х80см, 9009",657
"Батарейки щелочные, 2 шт, щелочная, тип D, BL, FORZA ""Alkaline""",461
"VETTA Насадка для швабры МОП, Премиум 400гр, хлопок, длина 35см",419
"VETTA Сумка хозяйственная ""Клетка"", 55x65x30см, 105 литров, до 12кг, полипропилен, 2 цвета",307
ARTEX Мыльница настенная Rainbow арт.29 13 15,279
"VETTA Корзинка универсальная ""Стокгольм"", 25,5x19,5x13,5см, пластик, 3 цвета",279
"VETTA Лоток для столовых приборов, 4 секций, пластик, 31х22х4см, 3 цвета",251
"VETTA Вешалка металлическая с объемными плечиками, бамбуковая перекладина, 40 см",237
"VETTA Корзинка универсальная ""Чикаго"", 24,5x17x12см, пластик, 4 цвета",237
"VETTA Чехол для сиденья унитаза 42,5х37см, искусственный мех, ПВХ, 2 цвета",223
"VETTA Сито-фильтр для раковины, 2,5х11(6,5)см, силикон, пластик",167
ARTEX Крючок тройной Slim арт.27 10 24,167
"VETTA Набор вешалок детских, 3шт, с покрытием флок, 3 дизайна",161
"Мыльница с поддоном, пластик, 11,5х7,6х2,7см, 3 цвета",153
"Щетка-трансформер хозяйственная, пластик, 12 см, VETTA",153
"VETTA Мыльница, ""Ромбо"", пластик, 13,5х9,5х3,5см, 4 цвета",153
"VETTA Крючок самоклеящийся, d6,5см, ПВХ",139
VETTA Шнур с металлической жилой 20м х 2мм,125
"Мыльница гибкая, ПВХ, 14,5x9,5см, ""Листок""",125
"Стакан для ванной комнаты полосатый, пластик, 2 цвета, VETTA",125
"Крючки самоклеящиеся на блистере Vetta, 2 шт",125
"Мыльница на ножках VETTA,металл, 12,5х9х4см, 2 дизайна",111
"Набор салфеток универсальных из микрофибры 3 шт, 30x30 см, 3 цвета, VETTA",111
"VETTA Вешалка для платков, 19х28см, с покрытием флок",111
"Лампа светодиодная FORZA С37, 7W, E27, 560lm, 4000К",97
"ЕРМАК Батарейки 2шт, тип AAA, ""Alkaline"" щелочная, BL",97
"Зажимы для скатерти, 4шт, полипропилен",69
"Блок для хранения мелочей, пластик, 12,5x13 см, 4 цвета, ""Корзина с ручками""",69
"Набор губок для мытья посуды 7 шт, 9х6х3,5 см, VETTA ""Эконом""",55
"Свеча хозяйственная 17,5см, d2см, 43гр.",41
"VETTA Коврик для ванной двухцветный, микрофибра, 50x80см, 2 цвета",1049
"Удлинитель FORZA 4 гнезда, 1кв.мм, 5м, с заземением, выключателем, евро, 16A, 3500Вт",979
"VETTA Коврик придверный, иглопробивной, 50х80см, 500г/м2, 3 цвета",839
"VETTA Шторка для ванной, винил, 180x180см, 12 колец, 3D, полоски, синий",839
"VETTA Пленка самоклеящаяся, 45см х 8м, ПВХ, ""Мозаика"", 4 дизайна",657
"БАРЬЕР Сменная кассета ""Железо"" Б-7",601
"АКВАФОР Сменная кассета, А5",601
"VETTA Шторка для ванной, ПЕВА, 180x180см, 12 колец, ""Лондария"", 4 дизайна",503
"VETTA Сумка хозяйственная ""Индия"", нетканый материал, 60x45x20см, 54л, до 11кг, полипропилен, 3 диз.",503
"VETTA Мыльница ""Ла Рош"", керамика, металл, 2 дизайна",475
"VETTA Набор вешалок деревянных, 3 шт, 44,5см, 2 цвета",419
"SILVER Дезодорант для спортивной обуви, 100 мл, SD3005-00/2005-00",391
"VETTA Замок велосипедный на дисковой тормоз, металл",349
"Ёрш для туалета с подставкой OSLO, пластик, лён",335
"VETTA Верона Чехол для одежды, 60х130см, спанбонд, ПЕВА",335
"EGOIST Краска для замши, нубука, велюра 180мл, черный",307
"VETTA Набор ажурных мешков для стирки: 30х40см на замке, d16x18h см для бюстгальтеров, полиэстер",307
"EGOIST Краска для замши, нубука, велюра 180мл, бесцветный",307
"VETTA Замок велосипедный противоугонный тросовый, 8х1000мм, металл, ПВХ, пластик",307
"Удлинитель Р16-010 3гн ШВВП 2x0,75 5м",239
"Чехол для одежды VETTA, 60х137 см, ПВХ",237
"Электрокипятильник 1000Вт, 220В, шнур 75см, погружная часть 17см",237
"VETTA Набор вешалок 3шт металл с ПВХ покрытием 40см, (цвет mix), TCH-103*3",237
"Крючки самоклеящиеся для полотенец на блистере 3 шт, ВЕСЕЛЫЙ РОДЖЕР",195
"SILVER Крем для обуви черный в железной банке, 50 мл",167
"VETTA Вешалка деревянная для юбок и брюк, с клипсами, 28см, арт.171",153
"VETTA Набор вешалок для одежды 4шт, 42см, с покрытием флок",139
"VETTA Мешок для стирки белья, цилиндр, на замке, пластик, полиэстер, d15х16h см, 4 дизайна",125
"Бумага для выпечки BY Герои 6м x 30см, в пленке ГМ",97
ARTEX Крючок Hooky арт.29 17 00,97
"ЕРМАК Батарейки 2шт, тип AA, ""Alkaline"" щелочная, BL",97
"VETTA Мешок для стирки белья, на замке, полиэстер, 40х50см",97
"Крем для обуви, банка с губкой 50мл, черный, люкс, Эффектон, 2114111",97
"VETTA Ролик для чистки одежды + 2 сменных блока, 10 листов Дизайн GC",89
"VETTA Набор губок для мытья посуды, коралл, 10 шт, 9,5x6,5x3,6 см",87
"Крючки самоклеящиеся для полотенец 2 шт, пластик/металл, 3 дизайна, ВЕСЕЛЫЙ РОДЖЕР WF-039",77
"Удлинитель 3 гнезда FORZA 1 кв.мм 10 м, с заземлением, 16А, 3500Вт",1246
"Удлинитель 3 гнезда FORZA 1,5 кв.мм 7 м, с заземлением, 16А, 3500Вт",1119
"VETTA Флоренция Корзина с веревочными ручками, текстиль, 40х26хh25см, 3 цвета",979
"VETTA Набор ковриков 2шт для ванной и туалета, хлопок, 60x40см + 40x40см, ""Индия"", 6 цветов",741
"BY Дозатор для жидкого мыла ""Зеркало души"", керамика, 2 цвета",699
"VETTA Шторка для ванной, ПЕВА, 180x180см, 12 колец, ""Океан"", 4 дизайна",657
"VETTA Крючки на планке, 4 шт, металл, хром+белый, вакуумное крепление",601
"VETTA Коврик в ванну противоскользящий, ПВХ, 66x38см, ""Океанский прибой"", 2 дизайна",489
WISEN Зажигалка кухонная газовая WB-6 BEST FLEX (34511),391
"DURACELL Батарейка 2032 2шт, BL",339
"Салфетка для сушки посуды из микрофибры, 38x50 см, 210 гр./кв.м, 4 цвета, 2 дизайна, VETTA ""Узор""",321
"TOKER Разветвитель 2 гнезда, евро, с заземлением, 16А, 250В, белый",307
"VETTA Ведро ""Cuba"" круглое 9л, пластик, светло-голубой",307
"GP Super BY Original Батарейки 4шт, тип ААA, 24AGM-2CR4, BL",279
"Корзинка универсальная, пластик, 25,7х15,8х8 см, 2 цвета, Natural Style",209
"Вакуумный пакет VETTA с ароматом жасмина, 68х98 см",209
"VETTA Пленка на стекло статическая в рулоне ""Декор"", 2 дизайна 2D, 45х200см, ПВХ",209
VETTA Вешалка деревянная 45см с клипсами светлое дерево,195
"VETTA Романтика Набор крючков для полотенец 2 шт на присоске, пластик, 8x9,5см, 3 цвета",189
"VETTA Вешалка металл (сталь) с ПВХ покрытием и клипсами 40см (цвет mix), TCH-203",181
"VETTA Насадка для швабры 444-259, из микрофибры, 40x23см",167
"VETTA Вешалка деревянная 45см, цвет венге",153
"Стяжка для груза 10мм x 1,1м",139
"Мыльница Vetta ""Роттанг"", цвет микс",139
"VETTA Мешок для стирки белья на замке, полиэстер, 50х60см, 4 дизайна",130
"Салфетка вафельная из микрофибры, махровая, 30х30 см, 300г/кв.м, 3 цвета, VETTA",130
"Щетка-утюжок хозяйственная, пластик, 16 см, VETTA",125
"Салфетка перфорированная 10 шт, вискоза, 30x38 см",116
"Батарейки щелочные, 2 шт, тип AAA (LR03), BL, FORZA ""Alkaline""",111
"Набор прищепок 12шт, пластик, ""Дельфин""",111
"VETTA Термометр комнатный, пластик, 19х4см, ""Цветы"", на блистере",111
"VETTA Блокиратор дверей, d10х1см, 3 дизайна, ЭВА",105
ФУКС Ложка для обуви металлическая цветная 30см,97
"GRIFON Мешки для мусора 120 л.,10 шт., стандарт, рулон",89
House Lux Салфетки влажные для обуви 15шт,88
"Щетка с ручкой универсальная, для одежды и обуви, цвета микс",77
"VETTA Сумка хозяйственная джутовая, 32x34x18см, 3 дизайна",559
"Удлинитель 3 гнезда FORZA 0,75 кв.мм, 5 м, евророзетка, 6A, 1500Вт",499
"VETTA Коврик придверный, ворсовый с резиновой каймой, полукруг 40x60см, 3 дизайна",475
"VETTA Коврик придверный Техно 40х60 см, ПВХ, полиэстер, 2 цвета: серый / коричневый",447
"Звонок беспроводной FORZA 32 мелодии, 3.0VDC(2x1.5VAA), ZV008",419
"VETTA Дозатор для жидкого мыла ""Оливия"", керамика, 2 цвета",377
"Удлинитель Р16-010 3гн ШВВП 2x0,75 3м",321
"VETTA Замок велосипедный противоугонный, кодовый, тросовый, 8х650мм, металл, ПВХ",307
"VETTA Лоток для столовых приборов, 5 секций, пластик, 32,8х25х4см, 3 цвета",307
"GP Super Рыжий Батарейки 4шт, тип АА,15AGM-2CR, BL",279
"GP Super Рыжий Батарейки 4шт, тип ААA, 24AGM-2CR4, BL",279
"VETTA Пакеты для продуктов, 500шт, 22x33см, в рулонах",237
"VETTA Крючки самоклеящиеся, 2шт, 4,5x4,5см, нерж.сталь 201, 3 дизайна",209
"VETTA Вешалка металл с ПВХ покрытием 45см (цвет mix), TCH-202",195
"Коврик в раковину противоскользящий, d.32 см, 4 цвета, ПВХ, ""Яблоки""",195
"Термометр для бани и сауны малый, (t 0 + 140 С), ТБС-41",195
"VETTA Накладка-протектор для улучшения скольжения мебели, 8шт*25мм, 4шт*38мм, тефлон, ЭВА",181
"EGOIST Крем-краска для кожи, флакон с губкой, 75 мл, коричневый",181
"GRIFON Губки для мытья посуды 5шт, поролон, Bubbles, 900-104",181
"EGOIST  Крем-краска для кожи, флакон с губкой, 75 мл, черный",181
"Батарейки щелочные, 4 шт, щелочная, тип AAA (LR03), BL, FORZA ""Alkaline""",167
"VETTA Щётка для посуды полипропилен, 2 дизайна.",167
"VETTA Вешалка металлическая, бамбуковая перекладина, 40 см",167
"VETTA Коврик в раковину противоскользящий ""Яркий"", ПВХ, d28см",167
"Набор губок кухонных, 4 шт., металл, пластик, 70 гр, 3 цвета, VETTA",167
"VETTA Протекторы-насадки на ножки стула, 20х22мм, 4шт, ПВХ",153
ФУКС Ложка для обуви металлическая цветная 50см,139
"Набор салфеток универсальных из микрофибры Vetta, 25х35 см, 2 шт, цвет микс",139
"VETTA Романтика Полочка для ванной комнаты на присосках, пластик, 23х10,5х5см, 3 цвета",139
"Щетка универсальная Vetta, тонкая, 25х3,5 см",111
"Перчатки резиновые, прочные, с запахом лаванды, M, VETTA",111
"VETTA Набор прищепок 40 шт, пластик, 1/100 ПБ-020",111
"Бумага для выпечки 30x6 м, в пленке, GRIFON",63
"Набор металлических губок для кухни 3 шт, 15 гр, VETTA",49
Сменный блок для ролика для чистки одежды 8 листов,27
"Ложка для обуви пластик, 15см",17
"VETTA Подушка водостойкая для ванны на присосках, ПВХ, 29х31х5см, белая",979
"VETTA Сумка-шоппер хозяйственная, хлопок, ручки из эко-кожи, 42х38х10см, 3 дизайна",559
"BY Мыльница ""Зеркало души"", керамика, 2 цвета",559
"Удлинитель FORZA 3 гнезда, 2м, с зазем, евро, 16A, макс. мощность 3500Вт",517
"Удлинитель 3 гнезда FORZA 1 кв.мм 2 м, 10A, 2500Вт",391
"VETTA Мыльница, металл, хром+белый, вакуумное крепление",363
"VETTA Органайзер-переноска, пластик, 22,5х23х8,8см, 2 цвета",279
"Набор салфеток универсальных из микрофибры 4 шт, 25x35 см, 230 гр./кв.м., 4 цвета, VETTA ""Полоски""",279
"VETTA Безмен вертикальный, 25кг, металл",259
"Чехол для одежды VETTA, 60х160 см, ПВХ",251
"VETTA Ёрш для посуды пластик, молочный бамбук",237
"Ночник светодиодный 4LED с выключателем, 8,5х5х7,5 см, 220 В, 0,5 Вт, пластик, 3 цвета",209
"VETTA Окномойка со стальной ручкой 25см, зеленая, арт.KFC002",209
"Щетка для обуви натуральный ворс, 13x4x2см, арт.312",181
"Тряпка для пола из вискозы, 50x70 см, VETTA",167
"VETTA Набор прищепок 20шт ""Классик"", пластик",139
"Салфетка для стекол и зеркал из микрофибры, 30х30 см, 250 г/кв.м, 3 цвета, VETTA",133
Термометр оконный Липучка (-50 +50) Т5 картон. коробка,125
"Губка бытовая с чистящим слоем 3 шт,  7х10,5х2,5 см, VETTA ""Фигурная""",125
"SILVER Крем-блеск для обуви, банка с губкой, 50мл, черный, 3005-01/2005-01",125
"VETTA Сумка хозяйственная с вырубленной ручкой, нетканый материал, 32х42х10см, 13л, до 8кг, 3 диз.",125
"Лампа светодиодная FORZA A60, 9W, E27, 806lm, 3000К",111
"Батарейки щелочные, 2 шт, щелочная, тип AA (LR6), BL, FORZA ""Alkaline""",111
"Щетка универсальная, тонкая, с металлической щетиной, пластик, 17,5х4 см",111
"Лампа светодиодная FORZA G45, 5W, E14, 400lm, 4000К",97
"Набор салфеток универсальных 3 шт., 30х34 см., бамбуковое волокно, герои",91
"SILVER Крем-блеск для обуви с винтовым механизмом, 50мл, чёрный, KS3008-01/2008-01",91
"Перчатки резиновые, L, VETTA ""ПРЕМИУМ""",89
"Перчатки резиновые, M, VETTA ""ПРЕМИУМ""",89
"Щетка для обуви 18x3,5x1,5см, с ручкой, 803",88
"Набор губок металлических с мылом 6 шт, 60 гр, 6,5х4,5 см, VETTA",69
"Стяжка для груза 8мм x 1,1м",65
"Мыльница овальная, пластик, 12х8,5см, 3 цвета",43
"Набор губок для мытья посуды ""Профи"" 5 шт, 80х60х38мм (+/- 2мм)",35
"Ерш бутылочный, металл, пластик, 7x2x2 см, длина 21 см, VETTA",27
ФУКС Губка силиконовая для блеска черная,22
"Удлинитель 3 гнезда FORZA 1,5 кв.мм 5 м, с заземлением, евро, 16A, 3500Вт",839
"VETTA Шторка для ванной, винил, 180x180см, 12 колец, 3D, ""Венеция"", 4 дизайна",839
"VETTA Ёрш для туалета ""Тепло дерева"", пластик (СОСТОИТ ИЗ 2 ЧАСТЕЙ), 2 цвета",839
"DURACELL Basic Батарейки 4шт, тип AAA, BL",419
"Удлинитель 2 гнезда FORZA 0,75 кв.мм, 3 м, евророзетка, 6A, 1500Вт",419
"VETTA Щетка кухонная с кокосовым волокном, ручка пластик, 9,5x23,5см",307
