"НИКА Доска гладильная Ника 9, металл 122x40см, регулир. высота до 90см, европодставка под утюг, Н9",3919
"Сушилка для посуды настольная 55x25x39,5 cм, VETTA арт.AE-767",1990
"BY Швабра ПВА складная, 28см, окрашен., телескоп. ручка 114-141см",1386
"VETTA Швабра с насадкой из микрофибры, телескоп. черенок, нерж.сталь, 80-120см",1330
"VETTA Коврик для ванной, микрофибра, 50x80см, 3 цвета",1330
"VETTA Тележка + сумка, до 30кг, 36х26х94см, 28л, брезент, колеса ЭВА d16см, WQ-108",1290
"Сушилка для белья потолочная Лиана 1,5м, 5 линий, белая",1190
"VETTA Швабра с насадкой из микрофибры, телескоп. черенок сталь 66-110см, механизм-бабочка, NP-1201",1049
"Доска гладильная ГЛ1, 108х29см, без подутюжника",979
"Корзина для белья 50л пластик, ПБ",937
"Табурет квадратный, мягкое сиденье, металл, h47см, 29x29см, НИКА",881
"VETTA Сушилка для белья роторная 6 линий, 365х59х63мм, пластик",839
"VETTA Контейнер на колесиках универсальный, 11,5л, 49,5х18,5х17,4см, 3 цвета",769
"Набор для уборки: щетка, совок, пластик, металл, ПВХ, 2 ручки, длина 62 см, VETTA",769
"Корзина для хранения с крышкой 17л, 36,5х27,5х21,5см, пластик, 2 цвета",601
"VETTA Пленка самоклеящаяся, 45см х 8м, ПВХ, ""Кирпич/Камень"", 4 дизайна",559
"VETTA Пленка самоклеящаяся, 45см х 8м, ПВХ, ""Восточная плитка"", 4 дизайна",559
"VETTA Пленка самоклеящаяся, 45см х 8м, ПВХ, ""Цветы"", 4 дизайна",517
"VETTA Винсент Кофр для хранения постельного белья, ПЕВА, 55х36х20см, 2 дизайна",475
"Карниз для ванной 2м, белый",419
"VETTA Пленка самоклеящаяся солнцезащитная для окон, 45х150см, ПЭТ, 6 цветов",307
"FORZA Светильник на прищепке, E27, 40Вт, 220В, гнущаяся ножка 10см, шнур 75см, 5 цветов",269
"VETTA Пленка на стекло самоклеящаяся, в рулоне, 2 дизайна, 45х200см, ПП",265
"VETTA Контейнер для ватных дисков/палочек ""Вертикаль"", керамика, 3 цвета",223
"VETTA Верона Кофр на молнии с прозрачным окном 40х30х20см, спанбонд, ПЕВА, 2 цвета",217
"VETTA Швабра эконом с насадкой из микрофиб. без подкл., телескоп., металл, 70-120см, насадка 50г",209
"Ведро пластмассовое, 5 л, Лукошко",167
"VETTA Вешалка накидная на дверь, 5 крючков, 24,5х2,5х9,5 см, металл",153
"Паста ГОИ полировальная, 8г",153
"Лоток для столовых приборов, 30х22х4,5см, пластик, Р2030",125
"Контейнер для мелочей ""Ежедневный"", 7 отсеков, цвет микс",125
"Бокс для таблеток, пластик, 8,5 см, 3 цвета,  ""Неделька""",97
"Таз пластмассовый круглый 6,5 л  цветной, ПБ",58
"Перчатки полиэтиленовые, М, 100 шт, VETTA",55
"Шпажки-шампуры из бамбука 90 шт, 25 см, d.3 мм, VETTA",42
"Мешки для мусора 30 л., 20 шт., эконом, рулон",19
"Сушилка для белья напольная ""Премьера"" длина прутьев 20м, сталь d16мм в пластике",3766
"VETTA Сушилка для белья напольная, алюминий, 18м",3626
"НИКА Доска гладильная Лина-4, ДСП, 112х34,5см, h70-80см, подст.под утюг,подрукавник,удлинитель,ДЛ-4",2086
"BY Швабра с насадкой CHENILLE 44x15см, телескоп.ручка 83-126см",1946
"VETTA Коврик кухонный универсальный ""Узоры"", ПВХ, 120х45см, 2 дизайна",1666
"Полка настенная, угловая, трёхъярусная, ARTEX Slim, арт.27.10.39",1246
"VETTA Сушилка для белья напольная, 18 м, сталь, 141х53х89 см",1119
"VETTA Флоренция Корзина для белья, алюм.ручки, 36х60см, 3 цвета",1119
"VETTA Набор ковриков для ванной ""Коралл"", 75х45см + 45х40см, микрофибра, 4 цвета",1077
"Набор для ванной, 3 предмета, керамика, Сити",839
"VETTA Набор щётка с длинной ручкой + совок пластик, молочный бамбук",797
"VETTA Контейнер в холодильник, выдвижной, 29х10х17см, пластик",699
"VETTA Коврик для ванной, 50х75см, микрофибра, 2 цвета",699
"VETTA Барселона Органайзер подвесной многоцелевой, 1 отд., 3 кармана, 2 крючка, 30х11х20см, 4 диз.",559
"Пленка самоклеящаяся, 45см х 8м, ПВХ, ""Домашний очаг"", 4 дизайна",559
"VETTA Весы портативные электрон., ЖК-дисплей, макс.нагр. до 500гр, (погр. 0.1 грамм) 2xААА, 12x6см",559
"VETTA Сушилка для посуды, складная, 36x12х31см, пластик, силикон",559
"VETTA Швабра с насадкой из микрофибры, черенок 120 x d2,2см без телескопа, металл 0,2мм",461
"Корзина для хранения с крышкой 11л, 36,5х27,5х14см, пластик, 2 цвета",447
"VETTA Шторка для ванной, винил, 180x180см, ""Мэринелла""",419
"VETTA Окномойка с телескопической ручкой 110см, синяя, арт.KFC004",391
"Сменная кассета ""Лайт"" на стрип-ленте для кувшинов-фильтров БАРЬЕР",377
"BY В ГОСТЯХ У СКАЗКИ Органайзер для мелочей, 16 секций, 35х27хh9см, 2 дизайна",363
"VETTA Пленка самоклеящаяся, 45см х 8м, ПП, 4 дизайна",335
"Подставки антивибрационные для стиральных машин и холодильников 4шт., резина, d45х20мм",307
"SVIP Веник ""Практик"" аквамарин, SV4197АКВ",265
"BEROSSI Подставка для моющего средства и губки Teo plus, 19х12х10см, пластик, 4 цвета",265
"Перчатки нитриловые, 10 штук, VETTA",251
"Таз пластмассовый круглый 12л, 10 цветов",195
"VETTA Шторка для ванной, ПЕВА, 180x180см, ""Марсельеза"", 4 диз.",169
"Газ для зажигалок, 140 мл., белый, RUNIS",139
"VETTA Насадка для швабры из микрофибры, 10х40см, ""Полоска"", 4 цвета, 3701",119
"Коврик для ванны противоскользящий Vetta, 45x35 см, цвет микс",75
"Тряпка для пола из микрофибры, 50x70см, 150г/кв.м., 3 цвета, ГМ",75
"Чехлы для одежды, 60х150см, 3 шт, полиэтилен",55
"Вешалка для одежды, пластик, р.46-48, черная, Р2901",18
"FORZA Лампа настольная, E27, 50см, 60Вт, 220В, с выкл.на шнуре, шнур 100см, металл, 3 цвета",1806
"BY Швабра ПВА, двойной ряд роликов 28см, окрашен.,телескоп.ручка 109-132см",1666
"Подставка для обуви - 2 полки, 65см, металл, чёрная, ПО262",1526
"Коврик для ванной, синель, 3,5 см, 40х60 см, 3 цвета, VETTA ""Перламутр""",1246
"FORZA Лампа настольная, 12 LED, 5Вт, диммер, с сенсор. выкл., 360 Лм, АБС пластик, 2 цвета",1190
"VETTA Тележка + сумка, до 15кг, 32х22х86см, 22л, брезент, колеса ЭВА d15см, HT-196-A",1090
"Сиденье для унитаза ПВХ, 40x36см, ""Графика""",1049
"VETTA Набор для ванной 3 пр. ""Ветта"", керамика, 2 цвета",979
"VETTA Ведро складное силиконовое, 10 л, 3 цвета",979
"FORZA Лампа настольная, 16 LED, питание USB, кабель 1.5м, 1200Lux, аккум.1200мАч, белая, пластик",909
"VETTA Термометр электронный, выносной датчик температуры, влажность,12.5x7см, пластик,1xAAA",839
"VETTA Набор для ванной 3 пр., керамика, ""Соблазн"", 2 дизайна",797
"VETTA Швабра ПВА Эконом стальная ручка 110см, один ряд роликов, арт. PO06",769
"VETTA Набор для ванной ""Тиснение"", 3 предмета, керамика, 2 цвета",741
"Сиденье для унитаза, пластик, 41x35,5см, белое",699
"VETTA Пленка самоклеящаяся, 45см х 8м, ПВХ,  блестящая ""Цветы"", 4 дизайна",657
"Пленка самоклеящаяся, 45смх8м, ПВХ, мрамор",657
"Ведро для мытья полов с ручкой прямоугольное, пластик, 45х15х17 см, 4 цвета",629
"FORZA Лампа настольная, 14 LED, питание USB, кабель 1.5м, 600Lux, белая, пластик",559
"VETTA Термометр электронный 2 режима, с уличным датчиком, пластик, 7,5x7,6см, TA-268A",531
"FORZA Фонарь-лампа на прищепке, 6 LED, питание USB, с выключателем",489
"Короб для хранения складной с ручкой VETTA, 32х24х13 см, 3 дизайна, пластик",419
"Контейнер универсальный ""ROLLY"", 2,65л, 150х266х87мм, 2 цвета: бесцветный, коричневый",377
"VETTA Дозатор автомат. настен. д/зуб.пасты с держателем под 2 зуб.щетки,7х6х13,5см, пластик, 3 цвета",377
"VETTA Коврик универсальный, иск.мех, полиэстер 15мм, 40х60см, 3 цвета",377
"EGOIST Стельки для обуви гелевые женские смягчающие, ТЭП 28х9см",321
"VETTA Корзинка универсальная, металл, 28х22х12см, 2 цвета",321
"VETTA Подтяжки для простыни, 4шт, 24-45см, металл, полиэстер",279
"BY РЫЖИЙ Коврик антипригарный для приготовления, многоразовый, прочный, 40x33см, 0,2мм, тефлон",209
"VETTA Пакеты для продуктов, на резинке, 50шт, d10-30см, полиэтилен",153
"Салфетки универсальные 100 шт.в рулоне, 20x22 см., спанлейс, герои",149
"VETTA Окномойка с пластиковой ручкой 41см, черная, арт.KFC003",139
"Держатели для полотенец 5 шт, металл",111
"Шторка для ванной Vetta, ""Легкость"", цвет микс",89
"Коврик для сушки посуды, губчатая вискоза, 25х38 см",49
"VETTA Губка для удаления пятен, розовая, меламин, 9х6х3см",29
"VETTA Сушилка для белья напольная, вертикал., 4 полки, на колесиках, окрашен. сталь, 70x61x175см",3766
"Салфетка для стекол и зеркал из микрофибры Vetta, 30х40 см, цвет микс",2949
"FORZA Лампа настольная, 16 LED, 7Вт, с выключателем, 480 Лм, АБС пластик, 3 цвета",1666
"VETTA Коврик универсальный, 43х118см, полипропиленовое волокно, резиновая подложка, 2 дизайна",1386
"Салфетка из микрофибры универсальная Vetta, цвет микс",1218
"Полка двойная, хром, вакуумное крепление, 230х134х329 мм, VETTA",1119
"БАРЬЕР Фильтр-кувшин 3,6л ""Лайт"" белый",1077
"VETTA Термометр электронный 2 режима, с уличным датчиком, пластик, 10,8x10см, HTC-3",979
"VETTA Лоток для столовых приборов, металл, 36х20х4,5см",559
"FORZA Лампа настольная, 14 LED, питание USB, с зажимом, кабель 1.5м,  600Lux, белая, пластик",559
"Сменная кассета ""Классик"" для кувшинов-фильтров БАРЬЕР",517
"BY В ГОСТЯХ У СКАЗКИ Кофр для крупных вещей с окном на молнии, 60х40х25см, 3 ручки, спанбонд, 2 диз.",517
"VETTA Коврик для ванной, флис, губка 0,5 см, 40x60см, 3 дизайна",489
"VETTA Дозатор для жидкого мыла, ""Мрамор"", керамика, 2 цвета",489
"BY В ГОСТЯХ У СКАЗКИ Набор коробов для вертикального хранения вещей, 2 шт, 35х15хh10см, 2 дизайна",475
"Бокс для мелочей, пластик, 17х11,5х11,5 см, 3 цвета",475
"VETTA Дозатор для жидкого мыла ""Вертикаль"", керамика, 3 цвета",447
ARTEX Держатель для туалетной бумаги и освежителя воздуха Slim арт.27 10 42,419
"VETTA Перчатки для мытья посуды, 250 гр, силикон, 4 цвета",419
"Ёрш для туалета полосатый, пластик, 2 цвета, VETTA",377
"VETTA Окномойка с телескопической ручкой 111см, с резин.держателем, серая, арт.KFC010",377
"VETTA Корзинка плетенная ""Амелия"" 24x24x8см, 2 дизайна",299
"Вакуумный пакет VETTA с ароматом лаванды, 60х80 см",223
"VETTA Футляр для зубных щеток и пасты, полипропилен, 5х5х20см, 3 цвета",223
"Электрокипятильник 500Вт, 250В, шнур 65см,  погружная часть 10см",181
"VETTA Сумка-авоська хозяйственная, 35х63см, 100% хлопок",149
"Удлинитель Р16-010 3гн ШВВП 2x0,75 1,5м",149
"Насос для вакуумных пакетов VETTA, арт. PUMP",139
"Вешалка для одежды деревянная 45см, ПРОМО",125
"PROMO Лампа светодиодная A65 7W, E27, 400lm 4200К",69
"Набор перчаток, латекс, M, 10 шт, VETTA",59
"VETTA Насадка эконом для швабры из микрофиб., без подкладки, 12х40см, ""Лапша"", 4 цвета, вес 50 г.",55
"EGOIST Стельки для обуви, влаговпитывающие, р-р 36-46, ss-ss018",49
"Крючок s-образный, металл",41
"Бумага для выпечки (пергамент) 5м x 30см, коричневая",29
"Вешалка для одежды, пластик, р.48-50, черная",9
"VETTA Швабра с насадкой из микрофиб. (подкл.), телескоп.  металл, пластик, 70-120см, вес насад 95 г.",249449
"VETTA Губка запасная для швабры ПВА, 27см",99149
"BY Светильник настольный ""Стокгольм"", 49 см, E27, 60Вт, 220-240В, металл, дерево, черный",1806
"VETTA Коврик для ванной, шенилл, 60x90см, ""Бархатная роскошь"", 2 цвета",1386
"VETTA Коврик в прихожую, искусственный лен, резина, 120x45x0,3см, 3 дизайна",1246
"VETTA Флоренция Корзина для белья с металл.обручем, текстиль, 35х55см, 3 цвета",1246
"VETTA Шторка для ванной, ПЕВА, 180x180см, ""Блестящая"", 2 дизайна",1190
"НИКА Табурет, металл, МДФ, мягкое сиденье, h47см, d29см, ТБ3",839
"VETTA Ёрш для туалета силиконовый с возможностью крепления на стену, полипропилен, d10х42см",769
"VETTA Швабра МОП с цельной насадкой из микрофибры, нерж. сталь, 110см",769
"Лента светодиодная 2835белая, 5м, монтажный клейкий слой, 12В/2А ч/з блок питания, без комплектующих",699
"VETTA Коврик придверный, резиновый с ворсом полиэстер, 40x60см, 5 дизайнов",699
"Короб для хранения складной с ручкой VETTA, 37,5х28х15 см, 3 дизайна, пластик",699
"VETTA Шторка для ванной, ПЕВА, 180x200см, ""Маренго"", 2 диз.",629
"VETTA Безмен электронный с дисплеем, с подсветкой, пластик, макс. нагр. 50кг, 3 цвета",629
"Сиденье для унитаза детское VETTA, поролон, ПВХ, 29х28 см, 3 дизайна",559
"Аккумулятор Forza Ni-Mh 800mAh AA 2шт в блистере 1,2В",391
"Зажигалка для газовой плиты пьезо, АА батарейка (нет в комплекте), блистер",377
"EGOIST Стельки для обуви гелевые мужские смягчающие, ТЭП 31,5х9,5см",349
"VETTA Винсент Кофр для подушек и одеял, ПЕВА, 60х40х25см, 2 дизайна",335
"Органайзер универсальный 195х160х146мм, 2 цвета: бежевый флэк, светло серый",265
"Вакуумный пакет VETTA, 90х40х100 см",259
"Таз пластмассовый круглый с ручками, 12 л, цвет микс",237
"VETTA Контейнер в холодильник, пластик, 7,5х16,5х20,5см, 3 цвета",203
"VETTA Шторка для ванной, ПЕВА, 180x180см, ""Яркий однотон"", 3 цвета",195
"VETTA Дозатор для жидкого мыла, пластик, 7,5х9,8х13см, 2 цвета",195
"Застежки для картин самоклеящиеся, настенные, SR, большие, 4шт 70х32мм, ПВХ, 1804",195
"Лампа светодиодная FORZA A60, 12W, E27, 1050lm, 4000К",181
"Щетка-сметка для пыли, пластик, 61 см, 4 цвета, VETTA",167
"Ночник светодиодный 4 LED с выключателем, 220 В, 0,5 Вт, 8х7х3 см, пластик",139
Щётка для чистки посуды и решеток барбекю Vetta,119
"Шнурки для обуви, 6 пар, разноцветные, 1м",116
"VETTA Накладки-протекторы войлочные для мебели, 4 штуки 3,7 см, 16 штук 1,8 см, фетр",65
"Термометр оконный Стандарт (-50 +50) п/п, ТБ-202",55
"Мешки для мусора Vetta БИО, 30 л, 20 шт",49
"Батарейки, 5 шт, СR2032 литиевые, BL, FORZA",45
"VETTA Тележка + сумка, до 30кг, 27х32х88см, 23л, брезент, колеса ЭВА d15см, WQ-162",1890
"FORZA Лампа настольная, E14, 30см, 40Вт, металл, текстиль",1049
"VETTA Набор для ванной 3 пр., керамика, ""Лагуна"", 2 дизайна",881
"VETTA Сумка хозяйственная водонепроницаемая, оксфорд 600D, 80х46х26см, 95 литров, до 50кг, 2 цвета",839
"VETTA Окномойка со съемным скребком доп.насадка из микроф. 29см., телескоп.черенок 110см нерж.сталь",839
"VETTA Набор для ванной ""Мозаика"", 3 предмета, керамика, 2 дизайна",741
"VETTA Сушилка для белья роторная 4 линии, 295х59х63мм, пластик",699
"Карниз для ванной угловой, нерж.сталь, 90x90x90см",699
"VETTA Коврик для сушки посуды, силикон, 30х22.5см, 90г, 3 цвета",559
"VETTA Весы кухонные механические, пластиковая чаша 800мл, макс. нагр. до 5кг, 4 цвета, СХ-129",499
"FORZA Фонарь-лампа складная, 30LED, питание 4xAAA, шнур USB, пластик",499
"VETTA Корзинка универсальная с крышкой, 25,5x25,5x16см, пластик, 2 цвета",419
"VETTA Романо Короб для хранения без крышки, 30х30х30см, спанбонд",419
"VETTA Корзинка универсальная ""Сиэтл"", 24x16,7x11,2см, пластик, 2 цвета",349
"VETTA Короб для хранения со съемной крышкой, 32х25х25 см, картон",349
"VETTA Сумка хозяйственная ""Клетка"", 60x50x30см, 90 литров, до 10кг, полипропилен, 2 цвета",265
"VETTA Сумка хозяйственная ""Клетка"", 45x50x20см, 45 литров, до 10кг, полипропилен, 2 цвета",237
"Дозатор для жидкого мыла VETTA  полосатый, пластик, 180мл, 2 цвета",237
"VETTA Сумка хозяйственная ""Гламурная"", складная, 38х58х10см, 22л, до 8кг, полиэстер, 6 дизайнов",209
"Тряпка для пола из микрофибры в клетку, 50х70 см, 80 гр, 4 цвета, VETTA",195
"VETTA Сетка-органайзер на присосках для ванной комнаты, полиэстер, 37х37см",153
"Щетка для чистки ковров, пластик, 16,5х11 см, VETTA",153
"Щетка для одежды велюровая с переключателем, 25x5.5x1.6см",153
"Корзинка вязаная, пластик, 21х16х10 см, VETTA",149
"Насадка для швабры Vetta, 40x10 см",139
"Блокираторы для дверей и выдвижных ящиков 2шт., 11см",139
"Набор для записей: магнитная доска 2шт., 9,5х9,5см, пластик, маркер",130
"Амортизатор для мебели 25шт, силикон, d8мм",125
"Вешалка настенная, 6 крючков, эконом, металл, 32,5х5х3,5см",125
ФУКС Ложка для обуви металлическая цветная 55см с крючком,119
"Салфетка в клетку из микрофибры, универсальная Vetta, цвет микс",83
"Подставка для бумажных полотенец, металл, 13х27,5 см",79
"Держатель для мыла, губки, мочалки Vetta, цвета микс",49
"Мыльница на присосках, цвет микс",49
"Набор салфеток универсальных 10 шт., 20х30см, вискоза",31
"Набор салфеток универсальных 3 шт., 30х26 см., вискоза, 3 цвета.",19
"VETTA Тележка для сумок, грузоподъемность 40кг, металл, 95х35х46см, колеса d14см, хром",3206
"BY РЫЖИЙ Тележка + сумка, до 30кг, 33х94х28см, 29л, сатин, колеса ЭВА d16см",1806
"BY Набор щетка+совок, пластик, металл",1666
"VETTA Швабра с насадкой ПВА телескоп.ручка 120см, 1 ряд роликов",797
"Вешалка настенная ""Уют 7"" 7 крючков, металл, черная, ВНУ72",741
"Коврик для ванной, синель, 1,2 см, 40х60 см, 3 цвета, VETTA",629
"VETTA Безмен электронный, пластик, вертикальный, макс.нагрузка 25кг (точн.измер=5гр), 1xCR2032, 4цв.",601
"VETTA Шторка для ванной, ПЕВА, 180x180см, ""Вертикаль"", 4 дизайна",559
"VETTA Подставка под тарелки, 24х15х9,5см, металл",559
"VETTA Шторка для ванной, полиэстер, 180х180см, ""Дельфин""",503
"Диспенсер для мыла с губкой в комплекте, пластик, 16х7х19 см, VETTA",503
