"EGOIST Сушилка для обуви раздвижная, пластик, 220-240В, 50Гц, 15Вт, температура нагрева 65-80 градус",489
"VETTA Дозатор для жидкого мыла, ""Ромбо"", пластик, 8,3х5,7х17см, 4 цвета",377
"VETTA Чехол для гладильной доски, антипригарный на  резинке 140х50см, полиэстер, подкладка поролон",377
"Штрих мебельный, 20 мл., 4 цвета",321
"VETTA БАРСЕЛОНА Корзина для белья с ручками, текстиль, 40х50см, 4 дизайна",299
"VETTA Термометр мини, измерение влажности воздуха, квадратный, 7,5x7,5см, пластик, блистер",279
"Корректор эмали, белый, 20мл",279
"VETTA Термометр + влагомер на блистере, 6,3см, металл, пластик, 3 цвета",265
"VETTA Палка для щетки усиленная, металл, пластик,120см",209
"Блок для хранения мелочей, пластик, 20x11x7 см, 3 цвета, ""Корзина""",195
"Аптечка-бокс дорожная 8 отделений, пластик, 10х6х3,5 см",195
"Тряпка для пола из микрофибры махровая, 50х70 см, 220г/кв.м, 4 цвета, VETTA",181
"Ночник в розетку FORZA с датчиком освещения, 220-240В, LED, цвет микс",181
"Звонок дверной электрический FORZA ""Канарейка"", 220В",167
"Колесо для тележек, пластик, ЭВА, 15см, 196-2",167
"EGOIST Стельки для обуви с антибактериальным эффектом, ss-ss141, р-р 36-46",83
"Ёрш для туалета ""Практик""/""Мини"", пластик, арт. 463000/463936",83
"EGOIST Стельки для обуви, комфорт, р-р 36-46, ss022",83
"Мешки для мусора с ручками 45 л., 20 шт., стандарт, герои",69
Футляр для зубной щетки RUNIS,63
"Пробка для ванны с цепочкой, резина, 29 см, d4,5 см",63
"Первая цена Батарейки 4шт, тип АA, ""Alkaline"" щелочная, BL",49
"VETTA Мешок для стирки белья, на замке, крупная сетка 40х30см",25
"Батарейки солевые ""Первая цена"", тип АА (R6), 4 шт",24
"Пакеты для завтраков в рулоне 50 шт, 17x28 см",12
"Удлинитель 3 гнезда FORZA 1,5 кв.мм 5 м, с заземлением, выключателем, евро, 16A,3500Вт",349699
"VETTA Набор ковриков для ванной и туалета, микрофибра, 45x70см + 45x45см, ""Азимут"", 4 цвета",1526
"FORZA Лампа настольная, 30LED, питание USB, кабель 1.2М, 2000Lux, белая, пластик",1386
"Подсветка рабочей зоны двойная, SMD 5050, хол. белый, 5м, IP65 водонепрониц., с резистором",1386
"VETTA Коврик универсальный ""Стиль"", тканый, хлопок, 50х80см, 4 цвета",979
"VETTA Сушилка для белья напольная 10 м., окраш.сталь, до 15 кг, 100х53х81см",839
"VETTA Шторка для ванной, оксфорд, метал. люверсы, 155x180см, ""Мраморные разводы""",797
"VETTA Коврик придверный, резиновый с ворсом полиэстер, 40x60см, ""Знаки"" 5 дизайнов",699
"НИКА Чехол универсальный с поролоном и термостойким покрытием, 480х1300мм (± 5 мм), арт. ЧПА",629
"VETTA Коврик универсальный ""Сан-Франциско"", 60х40см, 3 дизайна",629
"VETTA Шторка для ванной, ПЕВА, 180x180см, ""Цветущий сад"", 4 дизайна",559
"Коврик для ванны противоскользящий, ПВХ, 68x38см, 5 дизайнов, VETTA ""Сплит""",531
"Набор мини-ковриков для ванны противоскользящих 6шт, ПВХ, 6 дизайнов, VETTA ""Цветные""",475
"VETTA Корзинка плетеная ""Амелия"" 22х22х8см, 2 дизайна",475
"Карниз для ванной, алюминий, 2м, серебристый, VETTA",461
"VETTA Сумка хозяйственная ""Клетка"", 70x55x30см, 115 литров, до 10кг, полипропилен, 2 цвета",335
"VETTA Сумка хозяйственная трехслойная, 34х40х12,5см, 17л, до 10кг, полиэстер, золотая",335
"Ночник в розетку с датчиком света 8 LED, подсветка стены, пластик/металл",335
"VETTA Романтика Полочка для ванной комнаты на присосках, пластик, 26х7х8,5см, 3 цвета",279
"Аккумулятор Forza Ni-Mh 600mAh AAА 2шт в блистере 1,2В",279
"Коврик придверный 40x60см, полиэстер, резина",251
"VETTA Термометр оконный Биметаллический (-50 +50), блистер",181
"Светильник 4 LED точечный нажимной, d.6,5 см, 3xААА, пластик",149
"Мешки для мусора 240 л., 10 шт., прочные, ПВД, герои",139
"Мат антискользящий декоративный универсальный, 30х90см, ПВХ, 6 цветов",139
Разветвитель 3 гнезда,125
"Ведро пластмассовое 7 л, без крышки ПБ",99
"VETTA Планка с 3 крючками, самоклеящаяся, 2,5х12см, нерж.сталь 430",97
"Ерш бутылочный, 27 см, VETTA",69
"VETTA Накладки - протекторы на углы, 4см, ПВХ, 2 дизайна",69
"Ковш пластмассовый 1 л, цвет микс",59
"Батарейки, 10 шт, LR44 (G13) щелочная, BL, FORZA",49
"Перчатки резиновые желтые, M, VETTA",39
"Пакеты для замораживания перфорированные в рулоне 30 шт, 3л, 14 мкм",29
"Мыльница RUNIS, цвет микс",27
"Форма для запекания, алюминиевая фольга, d20,5cм, дно d16,7см, 1405мл, L-край, 99-02",17
"NORDWALL Сушилка для белья напольная ""бабочка"" Gamma, 18 м, 141х53х89 см",2086
"VETTA Набор ковриков 2шт для ванной и туалета, фланель, 45x75см + 45х45см, ""Милан"", 4 цвета",1330
"FORZA Лента светодиодная белая 5м, 3,5 Вт, 220В",1119
"VETTA Шторка для ванной, полиэстер, 180х180см, «Просторы», 2 диз.",909
"BY Швабра с насадкой из хлопка, вес 240 гр., длина ручки, 148 см",741
"VETTA Коврик придверный ""Швеция"", 80х60см, 2 цвета",741
"VETTA Корзина подвесная на полку, 35х26х13,5см, металл",657
"Коврик для ванны противоскользящий, ПВХ, 67x37см, 4 цвета, VETTA ""Сфера""",657
"VETTA Шторка для ванной, ПЕВА, 180x180см, ""Горошек"", 5 цветов",559
"BY ВУАЛЬ  Кофр для хранения нижнего белья, 32х32х12см,6 секций, 2 цвета",503
"Карниз для ванной, нерж.сталь, 2м",489
"VETTA Сумка хозяйственная, оксфорд 210D, 60х40х22см, 50 литров, до 25кг, 3 цвета",419
"VETTA Дозатор для жидкого мыла, ""Конфетка"", керамика, 6 диз/цв",349
"Вакуумный пакет VETTA, 73х130 см",321
"VETTA Набор универсальных крышек, 6шт, размеры от 6,5см до 19см, силикон, 3 цвета",321
"Лоток для столовых приборов, 5 секций, 33х26х4,5 см, пластик, ""Кантри"" арт.4846",279
"VETTA Замок велосипедный противоугонный тросовый, эконом, металл, ПВХ, пластик, 12x800мм",279
"Светильник с выключателем FORZA, 9 COB, 3хААА, 10х8см пластик",265
"VETTA Чехол для гладильной доски ""Лучшая цена"" на шнурке, 130x47см, полиэстер, подкладка иск.войлок",199
"Вантуз гофрированный, h29см",167
"Чехол для сиденья унитаза, искусственный мех, ПВХ, 44х37см, 5 цветов, ""Велюр-2""",139
"VETTA Щетка для посуды с мыльницей и дозатором, пластик, 8см",139
"VETTA Набор вешалок металлических, ПВХ покрытие, 41 см",129
"VETTA Кольца для шторок в ванную, 12шт, пластик, 6х4см, прозрачные",125
"Шнурки для обуви, 6 пар, черные, белые, коричневые, 1м",125
"EGOIST Защита для пятки 2шт, ТЭП W-718",111
"Адаптер-переходник, евро, 10-16А, 250V",97
"Держатель для моющих средств Vetta, цвет микс",91
"VETTA Набор салфеток для стирки против окрашивания 20шт, 25х12см",89
"Мешки для мусора с завязками 35 л., 15 шт.,стандарт, зелёные, рулон, герои",69
"Лампа светодиодная свеча FORZA С37, 7W, E14, 560lm, 4000К",59
"Набор губок для удаления пятен, меламин, 9х6х3 см, 2шт, VETTA",49
"Пакеты для льда VETTA, полиэтилен, 216 шариков, 25 мкм",29
"Рукав для запекания в пакете, 30см x 3м",29
"VETTA Сумка хозяйственная с вырубленной ручкой, нетканый материал, 40х50см, до 4кг, полипропилен",29
"Батарейки солевые ""Первая цена"", тип ААА (R03), 4 шт",24
"VETTA Сушилка для белья напольная, окраш.сталь, 18м",1946
"VETTA Набор ковриков 2шт для ванной и туалета, акрил, 50x80см + 50x50см, бежевый 4 дизайна",1386
"VETTA Коврик универсальный круглый, иск.мех, акрил, d70см, 4 цвета",1386
"Полка настенная, двойная с крючком, ARTEX Slim, арт. 27 10 34",1119
"VETTA Набор ковриков для ванной и туалета, фланель, 45x70см + 45x45см, ""Нежность"", 4 цвета",1021
"VETTA Ёрш для туалета ""Вертикаль"", керамика, 3 цвета",881
"VETTA ЛЁН Короб жесткий, складной метал.каркас, 2 молнии, 2 окна, полиэстер, 40х30х20см",839
"Удлинитель 3 гнезда FORZA 1,5 кв.мм 3 м, с заземлением, выключателем, евро, 16A,3500Вт",699
"VETTA Барселона Кофр подвесной настенный, 5 объемных карманов, 2 крючка, текстиль, 34х55см,4 дизайна",629
"VETTA Корзинка универсальная с ручками ""Стиль"", 34х24,5х16,5см, пластик, 2 цвета",461
"VETTA Чехол для одежды, 60х137см,  спанбонд, 2 цвета",391
"VETTA Сумка хозяйственная, неламинированный пропилен, 75х37х26см, 70 литров, до 10кг",335
"VETTA Мыльница, ""Мрамор"", керамика, 2 цвета",307
"Батарейка щелочная, 1 шт, тип Крона (6LR61), BL, FORZA ""Alkaline""",279
"VETTA Подставка для сушки столовых приборов, пластик, 9х7х11,5см, 3 цвета",265
"VETTA Корзинка универсальная ""Сан-Диего"",  25x19x14,5см, пластик, 3 цвета",265
"VETTA Стакан для ванной комнаты ""Вертикаль"", керамика, 3 цвета",245
"Вакуумный пакет VETTA, 70х100 см, с крючком",237
"VETTA Мыльница, ""Конфетка"", керамика, 6 диз/цв",223
"Карандаш мебельный, 6 гр., 5 цветов",209
"Лампа светодиодная FORZA A60, 14W, E27, 1250lm, 6500К",195
"Веревка бельевая, х/б, узбекская, 20м x d4мм, арт.46028/5-013",175
"Салфетка для ванной комнаты из микрофибры Vetta, 30х30 см, цвет микс",153
"ЕРМАК Батарейки 4шт, тип AA, ""Alkaline"" щелочная, BL",153
"VETTA Черенок деревянный в ПВХ пленке, разноцветный, 120см, d2,2см, 4 цвета, евро резьба",153
"Термометр комнатный Модерн (-10 +50) картон. блистер, ТБ-189",153
"Мешки для мусора GRIFON БИО, 30 л, 20 шт",139
"Лампа светодиодная PROMO, А60 9W E27 750lm 4200K",139
"Набор для уборки: совок, щетка, пластик, 29х19,5х6 см, 2 цвета, VETTA ""Практик""",111
"VETTA Набор мячей для стирки и сушки белья 2шт, ПВХ, d6,5см",109
"VETTA Вешалка металл с ПВХ покрытием 40см (цвет mix), TCH-103",97
"Набор салфеток для кухни 6 шт, вискоза, 30х38 см",55
"Набор губок в вакуумной упаковке, 3 шт, ""Кухоньчик Стандарт""",49
"Мешки для мусора 30 л., 20 шт., стандарт, рулон, герои",41
"Перчатки резиновые желтые, S, VETTA",35
"Перчатки резиновые желтые, XL, VETTA",35
"VETTA Насадка для швабры из микрофиб., подкл. полиэст., 10х40см, ""Лапша"", 4 цвета, вес 95 г.",99135
"BY Набор ковриков 2шт для ванной и туалета, ""Эквилибр"", флис, 80x50см + 50x40см, 3 дизайна",1246
"Набор для ванной, 3 предмета, керамика, 2 цвета, VETTA ""Богема""",1190
"VETTA Шторка для ванной, оксфорд, 155x180см, ""Ботанический сад""",769
"FORZA Лампа настольная, Е27, 28см, 40Вт, 220В, с выключателем, шнур 67см, 5 цветов",769
"VETTA Шторка для ванной с декоративными кольцами, ПЕВА, 180x180см, 3 дизайна",657
"VETTA Ёрш для туалета навесной, металл+ пластик, хром+белый, вакуумное крепление",629
"Коврик для ванны противоскользящий, ПВХ, 70x34см, VETTA ""Камни синий""",629
"VETTA Подставка для крышек/досок, 12х19х14см, металл, 2 цвета",629
"Коврик для ванны противоскользящий ПВХ, 37х68см, VETTA ""Морские Пейзажи""",559
"VETTA Английский стиль Чехол-кофр для одежды семейный, 60х30х120см, спанбонд, ПЕВА, 2 дизайна",559
"VETTA Стакан для ванной комнаты, ""Мрамор"", керамика, 2 цвета",447
"BY Губка запасная для складной швабры ПВА, плоская, 28см, влажная",349
"Корзина для белья складная, полиэстер, 36х36х58см, 5 цветов",349
"Сушилка для столовых приборов навесная, металл, 16x8х20 см, 844",335
"VETTA Романтика Полочка для ванной комнаты, на присосках, пластик, 25,5х18,5х3см, 3 цвета",279
"Вакуумный пакет VETTA с клапаном, 70х100 см, работает от пылесоса",279
"Коврик в ванну VETTA противоскользящий, ПВХ, 67x36см, ""Симпл"", 2 цвета",265
"VETTA Набор прищепок 4шт, Кошки, пластик, 2 цвета",195
"Насадка для швабры МОП эконом, 110 г, длина 40, кол-во 18, арт.6-072",167
"VETTA Сумка-шоппер хозяйственная, хлопок черный, 33x44см, 3 дизайна",159
"Сушилка для белья подвесная с прищепками Vetta, цвет микс",153
"VETTA Пробка-фильтр для раковины, 10x11см, ТПР",153
"VETTA Сетка для глажки белья, полиэстер, 40х60см",139
"VETTA Сумка хозяйственная ""Эмка"", нетканый материал, 30х35х10см, 10л, до 4кг, 4 дизайна",139
"Короб складной ""Узор"" 12х18х9см, полиэстер, HAPPI DOME, ADB-0520-03-DNS",139
"Короб складной ""Горох"" 12х18х9см, полиэстер, HAPPI DOME, ADB-0520-03-BNJ",139
"Набор салфеток универсальных 10 шт., 25х25см, микрофибра",125
"VETTA Термометр деревянный Классик малый, блистер, 20х4см",97
"VETTA Окномойка ""Практик"", пластик, резина, 12,5х15,7х6,7см, 2 цвета",83
"VETTA Вантуз, пластик, резина, d=10см (поставляется в 2х частях)",79
"EGOIST Полустельки под стопу, гелевые 2шт QBD-058",69
"Набор салфеток для кухни из вискозы Vetta, 3 шт, цвет микс",55
"Ерш туалетный без подставки Vetta ""Практик"", цвет микс",55
"VETTA Подставка для обуви с регулировкой высоты, 24,5х10х6/17 см, пластик, 3 цвета",49
"VETTA Вешалка металлическая , ПВХ покрытие, 40 см",35
"Доска гладильная ГЛ5, 124х35,5см, с полкой для утюга и белья",2506
"VETTA Коврик универсальный жаккардовый с кистями, микрофибра, 50x100см, 2 дизайна",1750
"Удлинитель 5 гнезд FORZA 1,5 кв.мм 3 м с заземлением, выключателем, евро, 16A, 3500Вт",909
"Корзинка вязаная, пластик, 38х28х23 см, 4 цвета, VETTA",699
"Карниз для ванной, нерж.сталь, 2,6м",601
"Держатель для зубных щеток и пасты, хром, вакуумное крепление, 154х60х176 мм, VETTA",531
"VETTA Замок велосипедный, цепь, 5cм -1000мм",503
"VETTA Набор для уборки: щётка + совок, пластик, молочный бамбук",461
"Держатель для туалетной бумаги с крышкой SonWelle Классик, хром",461
"VETTA Сушилка для посуды на раковину, складная, 47х22см, нерж. сталь, TPE",419
"Звонок беспроводной FORZA 32 мелодии, 3.0VDC(2x1.5VAA), ZV001",419
"Тележка для мелочей VETTA, ""Супермаркет"", металл, 14х13,5х9 см",419
"Салфетка для сушки посуды из микрофибры, 38x50 см, 210г/кв.м, 4 цвета, VETTA ""Вензеля""",349
"Вакуумный пакет VETTA с клапаном, 60х80 см, работает от пылесоса",279
"VETTA Щётка утюг для уборки, пластик, молочный бамбук",259
"VETTA Пакеты с замком-слайдером, 10шт, 20х30см, 50мкм, 3 литра, полиэтилен",237
"VETTA Пленка на стекло самоклеящаяся ""Классика"", в рулоне, 2 дизайна 2D, 45х200см, ПП",237
"SILVER Спрей водоотталкивающий универсальный для всех типов изделий, 250 мл., ST3501-00/2501-00",219
"Салфетка для мебели из микрофибры супервпитывающая, 30х30 см, 330 г/кв.м., 4 цвета, VETTA",209
"Зажигалка кремниевая кухонная , эргономичная ручка, 23 см, блистер, WH-231",167
"Вешалка надверная, 2 крючка, металл, 12х15х5см, 3 цвета",167
"VETTA Шпагат х/б 100г, 50м x 2,5мм",153
"Блокираторы для дверей и выдвижных ящиков 2шт, гибкий, 17см",153
"Салфетки универсальные для уборки 150 шт.в рулоне, 20x17 см., спанлейс",143
"Веревка Vetta, 12 м, цвет микс",139
"Салфетки влажные СМАРТ Эконом 80шт, универсальные антибактериальные, для уборки 6 в 1, арт.30909",125
"VETTA Мешок для стирки белья, цилиндр, на замке, мелкая сетка d20x25см",125
"VETTA Замок велосипедный противоугонный тросовый, металл, ПВХ, пластик, 7x600мм",111
"Насадка для швабры из микрофибры, 10х40см, ""Полосатая"" эконом,арт.ТН-804",97
"Батарейки FORZA 10шт LR41 (G3) щелочная, BL",97
"Набор губок для мытья посуды Лёгкая уборка, 5 шт, 9,5 x6,5x3,6 см",83
"Блок для хранения мелочей ""Корзина с ручками"", цвет микс",83
"VETTA Коврик для сушки посуды, 30х40см, 320г/м2, ПВХ",69
"Щетка-утюжок хозяйственная Vetta, цвет микс",49
"BY Сумка-шоппер 40х45х16см (шелкография), спанбонд черный",49
"Заглушки для электрических розеток с держателем, 4шт, пластик, d3,2х2,2см",48
"Доска гладильная НЕВА 6, 124х35,5см, с полкой для утюга и белья с удлинителем",3066
"VETTA Коврик придверный ""Ждем в гости"", 75х45см, 3 дизайна",909
"VETTA Шторка для ванной, оксфорд, метал. люверсы, 155x180см, ""Голубая бездна""",797
"VETTA Коврик в прихожую с резиновой каймой, полиэстер, резина, 50х80см, 4 цвета, CR001",741
"VETTA Чехол для гладильной доски на резинке, хлопок, подкладка хлопок, 130х50см, 3 дизайна",657
"VETTA ЛЁН Комплект коробов с 3 объемными карманами, 2 шт, текстиль, 25х15х12см,серый",601
"VETTA Замок велосипедный противоугонный кодовый 12x800мм, 427",559
"Набор для домашнего ремонта ""Добрый реставратор"" (воск 2цв*3г + маркер 3мл + штрих 20мл) Мастер Сити",517
"VETTA Насадка для швабры МОП 200гр, микрофибра, длина 25см/29см",475
"VETTA Шторка для ванной «Перышко», ПЕВА, 180х180см, 4 диз.",419
BY Насадка для швабры из микрофибры 44х15см,391
"Щетка с насадкой из микрофибры со сгибающимся корпусом, 58 см, 4 цвета, VETTA",307
"VETTA Винсент Чехол для одежды, ПЕВА, 60х130см, 2 дизайна",279
"VETTA Дозатор для моющего средства с губкой, пластик, 14x10,5x9см, 3 цвета",279
"Набор восковых мелков 3шт, 12х1х1см, 4 цвета",279
"VETTA Сумка-шоппер хозяйственная, хлопок светлый, 33x44см, 3 дизайна",279
"Ёрш для туалета ""Плетение"" с подставкой, полипропилен, 14х14х40см, 3 цвета",265
"EGOIST Дезодорант для обуви антибактериальный, 100мл, алоэ",251
"VETTA Крючки самоклеящиеся, двойные, 2шт, 7х7х4,5см, ПВХ, металл",209
"SILVER Гель-очиститель универсальный для всех видов спортивной обуви, 50 мл, TG 2001-00",209
"VETTA Фиксатор дверей напольный, 2 шт, 13 см, ТПР, 2 цвета",195
"FORZA Ночник в роз.с выкл, 4LED-многоцвет, пластик, 5,5х8,5х6см, 220-240В, 0,5Вт,""Месяц со звездой""",181
"Смазка многофункциональная -15С +240С, 90 мл., RUNIS",167
"VETTA Коврик для сушки посуды, ПВХ, 30х40см, 780г/м2, 3 цвета",167
"VETTA Мешок для стирки белья, на замке, полиэстер, 50х60см",153
