"Щетка для чистки оконных проемов, поворот на 360 градусов, пластик, 21х7 см",139
"VETTA Держатель для бумажных полотенец, металл, 13х27,5см, #276",139
"Лампа светодиодная FORZA A60, 9W, E27, 806lm, 4000К",139
"Мешки для мусора с ручками 60 л., 20 шт., стандарт, герои",83
"VETTA Насадка для швабры из микрофибры, 10х40см, ""Ромбы"", 4 цвета",79
"EGOIST Пяткоудерживатели, гелевые 2шт. HGT014",69
"Щетка тройная для замши и нубука, основной уход, пластик, ПВХ, металл",69
"VETTA Пакеты для продуктов, 100шт, 22x33см, в рулонах",55
"Первая цена Батарейки 4шт, тип АAA, ""Alkaline"" щелочная, BL",49
"Форма для запекания, алюминиевая фольга, 21,7x11,3x5,3см, дно 18,1x7,7cм, 865мл, L-край, 99-01",35
"Совок для мусора VETTA ""Практик"", пластик, 29х19,5х5см",25
"Мешки для мусора 160 л., 10 шт., прочные ПВД, рулон, герои",6579
"VETTA Тележка+сумка со стулом, сумка до 30кг, 31л, стул до 120кг, 44x94x26см, брезент, колеса d16см",2786
"Набор губок для мытья посуды 5шт, 9,6х6,5х3 см, VETTA ""Премиум""",2545
"VETTA Коврик придверный, иглопробивной, 80х110см, 500г/м2, 3 цвета",1666
"VETTA Набор ковриков для ванной и туалета, искусственный мех, полиэстер, 50x80см+50x50см, 2 цвета",1526
"VETTA Набор ковриков для ванной и туалета, микрофибра, 45x70см + 45x45см, ""Восточная сказка"",4 цвета",1386
"VETTA Коврик для ванной, микрофибра, 50x80см, «Блик на воде», 2 цвета",1119
"VETTA Английский стиль Короб большой с двойной крышкой, 40х58х18см, спанбонд, 2 дизайна",979
"VETTA Держатель универсальный для столовых приборов, 23x13x13см, ПП, белый",797
"VETTA Шторка для ванной, оксфорд, метал. люверсы, 155x180см, ""Узоры на бежевом""",769
VETTA Вешалка универсальная многоярусная 45см антискольз. металл,699
"House Lux Салфетки-полотенца GIGA ROLL универсальные с теснением 220 шт. в рулоне,  25x20, спанлейс",629
"VETTA Стакан для ванной комнаты ""Ла Рош"", керамика, металл, 2 дизайна",559
"Звонок беспроводной FORZA 32 мелодии, 12V/23A, 2xAAA, с водонепроницаемой кнопкой",559
"VETTA Коврик придверный, иглопробивной, в полоску, 40х60см, 550г/м2, 3 цвета",559
"FORZA Блок питания для ленты светодиодной, 220-240В, 1.2А, пластик",559
"VETTA Карниз для ванной 2,6м, 2 цвета, алюм.",489
"Вешалка настенная ""Уют 5"" 5 крючков, металл, медный антик, ВНУ51",475
"Набор воска мебельного Мастер Сити ""Добрый реставратор"", 7 цветов",349
"VETTA Держатель угловой для банных принадлежностей на присосках, ПС, 18x25,5x3,5см, 3 цвета",237
"VETTA Планка с крючками, выдвижная, 26,5х3х4см, HIPS пластик",209
"Сумка-шоппер хозяйственная, хлопок, 35x42см, 4 дизайна",199
"VETTA Сумка хозяйственная ""Мобильник"", складная, 38х58см, до 8кг, полиэстер, 4 дизайна",195
"Держатель для губки, пластик, 9х7,5 см, VETTA ""Тренто""",167
"Батарейки щелочные, 4 шт, щелочная, тип AA (LR6), BL, FORZA ""Alkaline""",167
"BY Термометр оконный, 20x12см, для крепления на стекло, пакет",167
"VETTA Корзинка универсальная ""Цветы"", 13,5х17,5см, пластик, 2 цвета",153
"Набор салфеток для стекол и зеркал из микрофибры Vetta, 25х35 см, 2 шт, цвет микс",153
"VETTA Сумка хозяйственная ""Ягода"", складная, 38х58см, до 8кг, полиэстер, 4 цвета",153
"BY Скребок для окна, полипропилен",139
"Набор зажимов для пакетов 6 шт, пластик, 10 см",125
"Стакан для ванной комнаты Vetta, цвет микс",105
"EGOIST Стельки для профилактики плоскостопия, 2шт, ТЭП P27-06",88
"Стопор дверной, магнитный пластик, металл, 2,5х5см, коричневый",55
"Ерш бутылочный, металл, пластик, 7x2x2 см, длина 21 см, VETTA ""Конус""",43
"Перчатки резиновые желтые, L, VETTA",39
"Лампа настольная складная FORZA, 1xCOB, 1500Lux, 6000K, питание 4xАAA, USB кабель 1м, белый",839
"Звонок дверной FORZA 32 мелодии, 220В, пластик, металл",839
"VETTA Корзинка для столовых приборов, ""Кухня"", 25х34х4,4см, металл, 2 цвета",797
"VETTA Коврик в прихожую ""Цветочный сад"", полиэстер, 48x78см, 4 дизайна",741
"VETTA Чехол для гладильной доски на резинке, хлопок, подкладка хлопок , 140х50см, 3 дизайна",657
"VETTA Подставка для кухонных принадлежностей, пластик, 15х17х20,3см, 3 цвета",629
"Диспенсер для моющего средства с губкой, керамика, 18х10 см, 320 мл, 4 дизайна, VETTA",517
"Диспенсер для моющего средства с губкой, керамика, 16х13х6 см, 250 мл, 4 дизайна, VETTA",489
"VETTA Коврик в прихожую, полиэстер, 40x60см, вышивка",461
"VETTA Сушилка на раковину универсальная раздвижная, ПП, размеры мин 34,5x20x6,5 см, макс 48x20x6,5см",419
"EGOIST Сушилка для обуви, пластик, 220-240В, 50Гц, 10Вт, температура нагрева 65-80 градусов",377
"BY Губка запасная для швабры ПВА, 28см, влажная",349
"VETTA Замок велосипедный противоугонный тросовый 12x800мм, металл, пластик, 3 цвета, 187",279
"VETTA Наклейки интерьерные, ""Узоры"", 60х90см, ПВХ, 3 дизайна",251
"VETTA Винсент Чехол для одежды, ПЕВА, 60х80см, 2 дизайна",209
"VETTA Крючок-держатель самоклеящийся, 3шт, металл, 3 дизайна",195
"VETTA Мыльница ""Вертикаль"", керамика, 3 цвета",195
"Набор перчаток, ПВХ, M, 10 шт, VETTA",195
"Набор крючков S-образных VETTA  4 шт,  CWJ211",181
"VETTA Накладки - протекторы на углы, 4шт, 6х3см, каучук, 3 цвета",181
"VETTA Бокс для таблеток, 6 секций, 9,7х2х6см, пластик, 4 цвета",167
"Салфетка для сушки посуды из микрофибры 38x50 см, 87 гр, 4 цвета, VETTA ""Клетка""",139
"VETTA Набор губок для мытья посуды, d11см, поролон",139
"Лампа светодиодная FORZA MR16, GU5.3, 8W, 580lm, 4000К",139
"Лампа светодиодная FORZA MR16, 5W, 375lm, 4000K",125
"VETTA Вешалка металл для юбок и брюк 30см (цвет mix), TCH-902",116
"Шапочка для душа Vetta, цвет микс",111
"Лампа светодиодная FORZA G45, 7W, E27, 560lm, 3000К",111
"INBLOOM Термометр оконный ""Божья коровка"" 17x17см, для крепления на стекло, пластик, пакет",89
Коврик в раковину противоскользящий,83
"VETTA Набор прищепок 20шт, пластик",69
Ролик для чистки одежды 20 листов эконом,69
"Батарейки солевые, 4 шт, тип AA (R6), плёнка, FORZA ""Super heavy duty""",55
"VETTA Мешки для мусора Vetta ""Bio"" 60 л,10  шт",49
Лампа накаливания Б230/Т230-95Вт Е27,31
Пленка пищевая в рулоне 30см x 10м,29
"BY РЫЖИЙ Набор ковриков для ванной и туалета, микрофибра, 45x70см + 45x45см",1526
"БАРЬЕР Рыжий Фильтр-кувшин, 4,0л",1246
"Удлинитель 5 гнезд FORZA 1,5 кв.мм 5 м с заземлением, выключателем, евро, 16A, 3500Вт",1119
"VETTA Набор щётка с ручкой + совок полипропилен, 2 дизайна.",1021
"Сушилка для кружек, металл, d 16 см h.33 см, АЕ-301",699
"VETTA Коврик придверный, паутинка, 38x58см, ПВХ, 4 цвета",629
"VETTA Коврик для туалета, 50х50см, микрофибра, 2 цвета",461
"VETTA ВЕРОНА Чехол для гладиль. доски на резинке, полиэстер, подкладка поролон, 140х50см, 2 дизайна",461
"VETTA Карниз для ванной 2,0м, 2 цвета, алюм.",447
"Ёрш для туалета с двойной щеткой, пластик, 37,5см",447
"VETTA Коврик универсальный ""Швеция"", 60х40см, 2 цвета",419
"INBLOOM Термометр оконный с креплением 9,5х23см, блистер",419
"TOKER Разветвитель 3 гнезда, евро, с заземлением, 16А, 250В, белый",377
"Корзина-подставка, пластик, 29,5х15х12 см, 4 цвета",349
"SILVER Пена растяжитель для обуви, 150 мл",349
"EGOIST Краска для замши, нубука, велюра 180мл, коричневый",307
"VETTA Вешалка деревянная 45x5,5см, светлое дерево, WCH-283",307
"Лампа филаментная FORZA A60, 7W, E27, 560 lm, 4000K",237
"Шампуры деревянные 100 шт, 30 см, GRIFON",209
"Сметка для удаления пыли телескопическая, пластик, полиэстер, 110х8 см, VETTA",153
"VETTA Крючок на дверь, 6 крючков, пластик, 32х3,5х10см",153
"САЯНСКАЯ Фольга алюминиевая 29см х 10м, особо прочная, 14мкм, в пленке",119
"VETTA Мешок для стирки белья, цилиндр, на замке, пластик, полиэстер, d15х16h см",119
"Лампа светодиодная свеча FORZA С37, 5W, E14, 400lm, 4000К",111
"Крючки самоклеящиеся на кухню Веселый Роджер, 6 шт, цвет микс",111
"Мыльница с крышкой пластик, 11,5х8х3,8см, 4 цвета",111
"Батарейки FORZA 10шт LR54 (G10) щелочная, BL",97
"Губка целлюлозная с жестким абразивом Hard, 1 шт, GRIFON",97
"BY РЫЖИЙ Зубочистки 180шт, бамбук, акриловая упаковка",77
"Щётка для мытья посуды, пластик, 23см, 2 цвета, VETTA",69
"Набор салфеток для кухни 3 шт, целлюлоза, 15х18 см, VETTA ""Spontex""",69
"BY РЫЖИЙ Шпажки-шампуры 90шт, бамбук, 20см, d3мм",69
"Батарейки FORZA  4шт ""Super heavy duty"" солевая, тип AAA (R03), плёнка",55
"Свеча хозяйственная 15,5см, d2см, 39гр.",25
Шнур хозяйственный плотный №3 - 10м. арт. 5-082,19
"Зубочистки бамбуковые Vetta, 60 шт",15
"Звонок дверной FORZA 32 мелодии, 3.0VDC (3xAAA), пластик, металл",839
"BY Насадка CHENILLE для швабры из микрофибры, 44х15см",797
"VETTA Чехол для гладильной доски «Город» на шнурке, 130*50см,  хлопок, подкладка, хлопок.",797
"VETTA Дозатор для жидкого мыла ""Роскошь"", акрил, стразы",559
"Карниз для ванной 2,6м, белый, VETTA",503
"VETTA Чехол для гладильной доски, антипригарный со шнурком 130х50см, полиэстер, подкладка поролон",447
"Сушилка для столовых приборов, металл, 16x16x7см, A 23",447
"Вешалка настенная ""Лоза 5"" 5 крючков, металл, черный, ВНЛ51",419
"VETTA Дозатор для жидкого мыла, ""Любовь с первого взгляда"", керамика, 2 цвета",419
"VETTA Держатель для стаканов и зубных щёток, металл, хром+белый, вакуумное крепление",360
"VETTA Пленка на стекло статическая в рулоне ""Орнамент"", 2 дизайна 2D, 45х200см, ПВХ",349
"Корзинка декоративная, пластик, полиэстер, d15x9см, 5 цветов",329
"Безмен бытовой механический, нагрузка до 20кг, пластик, 4 цвета, X-220",279
"VETTA Насадка для швабры арт.444-259, 30х40см., микрофибра, 4 цвета",237
"VETTA Крючки самоклеящиеся, прозрачные, 3шт, 27х55мм, PS, металл",231
"VETTA Фиксатор для коврика, липучка, PU, 4шт, 10х15см, 1,15мм",223
"VETTA Подставка под утюг, силикон, 27х15см",217
"Щетка для пола, пластик, 24х6,5х7 см, короткий ворс, 2 цвета, VETTA ""Бриз""",181
"Ерш для банок двойной, 38,5х4,5 см",181
"САЯНСКАЯ Фольга Гриль 29см х 7м, 20мкм, в пленке",161
"Коврик в раковину противоскользящий ""Кругляш"", 27x27см, 28х28 см, 4 цвета",153
"Ночник в розетку FORZA ""Капля"" с выключателем, 3LED-одноцветный",153
"ЕРМАК Батарейки 4шт, тип AAA,  ""Alkaline"" щелочная, BL",153
"Фольга алюминиевая 29см x 15м, 7 мкм, в пленке",139
"VETTA Наклейка на кафель, в мозаику, ПВХ, 60х90см, 0,13мм, 5 цветов",139
"Сито-фильтр для раковины Vetta, 13 см",139
"Набор вешалок плоских р.48-50, 3шт, цветные/белые, пластик, арт. Р2914НС3",139
"Мешки для мусора 120 л., 10 шт., прочные, рулон, герои",139
"VETTA Наклейка на кафель, прозрачная, ПВХ, 60х90см, 0,06мм",119
"Батарейки FORZA 10шт LR626 (G4) щелочная, BL",97
"Губка-мыльница для кухни Vetta, цвет микс",91
"Масло бытовое универсальное 20мл, RUNIS",83
"Тряпка для пола, хлопок, 50х75 см, 2,5 мм, VETTA",83
"Термометр оконный Липучка (-50 +50) Т5, блистер",83
"Пробка для ванны с цепочкой, резина, 29 см, d4 см",63
"Застежки для картин самоклеящиеся, настенные, SR, 1шт 61х27мм; 2шт 38х22мм; 3шт 38х15мм, ПВХ, 1807",53
"VETTA Окномойка двусторонняя (скребок 23см+микрофибра 25х7см), телеск.черенок нерж.сталь 105см",179299
"VETTA Набор ковриков для ванной и туалета, фланель с эффектом памяти, 50x80см + 50x50см, 2 цвета",2086
"ARTEX Полка настенная трёхъярусная с пласт.поддонами на самоклеящ.крючках, арт. 29.19.06",1526
"BY Набор для ванной 3 пр., керамика, ""Кошачий глаз"", 2 цвета",762
"VETTA Шторка для ванной, ПЕВА, 180x180см, ""Барселона"", 4 дизайна",629
"VETTA Коврик придверный, ворсовый с резиновой каймой, 40x60см, яркая полоска, 4 дизайна",559
"Карниз для ванной, алюминий, 2,6м, серебристый, VETTA",489
"VETTA Чехол для гладильной доски на шнурке, 130x47см, хлопок, подкладка иск.войлок",475
"Электрокипятильник, 2000Вт, 220-240В, шнур 50см, погружная часть 20см",419
"Держатель для туалетной бумаги Sonwelle с полочкой для телефона, нержавеющая сталь",419
ARTEX Мыльница настенная с держателем для шампуней Slim арт.27 10 40,391
"Зажигалка пьезо для газовой плиты, АА батарейка (нет в комплекте), блистер, WH-11",391
"VETTA Мыльница ""Золотая лира"", керамика, 2 диз.",377
"VETTA Сушилка для белья подвесная квадратная с прищепками 16 шт., пластик, 3 цвета",307
"VETTA Сито-фильтр для раковины, 3,5х11,7(6,5)см, силикон, нерж. сталь",279
"Лоток для столовых приборов, 4 секции, 33х19,5х4,5 см, пластик, ""Кантри"" арт. 4846",265
"GP Батарейки комплект ACM02-CR12, 12 шт",251
"VETTA Щётка для посуды с длинной ручкой пластик, молочный бамбук",245
"VETTA Романтика Мыльница на присосках, пластик, 12,5х9,5см, 3 цвета",223
"VETTA Пленка на стекло статическая в рулоне ""Романтика"", 2 дизайна 2D, 45х200см, ПВХ",209
"VETTA Стакан для ванной комнаты, самоклеящийся, пластик, 11,5х8х 9,5см, 3 цвета",195
"VETTA Корзинка универсальная с ручками ""Стиль"", 25,5х19х13,5см, пластик, 2 цвета",195
"Электрокипятильник, 500Вт, 220В, шнур 54см, погружная часть 8см",181
"Набор вешалок детских цветных 3шт, пластик, Р4002НС3",139
"VETTA Термометр с магнитом, пластик, 5,7х5,7см, 3 цвета, на блистере",125
"GRIFON Губки для мытья посуды 5шт ""Волна"", 9,5х6,5х3,6см, с индикатором замены, арт.910-039",111
Вилка с заземлением угловая 16А,111
"Набор шапочек для душа, 8 шт, ПВХ, цветные",105
"VETTA Набор вешалок для одежды 2шт, 42см, с покрытием флок",91
"EGOIST Подушечки защитные от излишней нагрузки и мозолей, 2шт, ТЭП W-712",83
"Фольга пищевая 5 м в пленке, 29см х 5м, толщина 9 мкм",83
"Губка кухонная в упаковке 4 шт, 8х12 см, 2 цвета, VETTA",69
"Пакеты для продуктов 100 шт, 24x37 см, в рулоне, VETTA",69
"VETTA Клипсы для полотенец 6 шт, пластик",63
"Ролик для чистки одежды, 60 листов",49
"Набор губок для мытья посуды 2 шт, 8,5х6,5х4,3 см, VETTA ""Профи""",35
"VETTA Тележка + сумка, с колесами для подъёма по лестницам, до 30кг, брезент, сумка 53х31х18,5см",1946
"ARTEX Полка настенная угловая трёхъярусная с пласт.поддоном на самоклеящ.крючках, арт. 29.19.16",1666
"VETTA Коврик придверный ""Животные"", ПВХ, 48x78x0,8см",881
"Стакан, хром, пластик, вакуумное крепление, 179х86х150 мм, VETTA",839
"VETTA Замок велосипедный противоугонный тросовый усиленный, 22х1000мм, металл, ПВХ",839
"Полка настенная, ARTEX Star, арт. 29 16 45",699
"BY Стакан для зубных щеток и пасты ""Зеркало души"", керамика, 2 цвета",657
"VETTA Шторка для ванной, ПЕВА, 180x200см, ""Этнографика"", 3 диз.",629
"VETTA Шторка для ванной, таффета, 155x180см, ""Весна"", 3 дизайна",629
"БАРЬЕР Сменная кассета ""Жесткость"" Б-6",559
"Вантуз вакуумный, пластик, d16см, h37см",503
"VETTA Набор вешалок деревянных 3шт, 45см, светлое дерево",419
"Звонок беспроводной FORZA 36 мелодии, 3.0VDC(2x1.5VAA), ZV007",419
"Электрокипятильник, 1500Вт, 220-240В, шнур 50см, погружная часть 17см",363
"VETTA Насадка для швабры из микрофибры, 41х12см, шенилл",349
"Чехол для одежды VETTA, 60х150 см, спанбонд",349
"Вешалка настенная ""Уют 3"" 3 крючка, металл, черная, ВНУ32",307
"Чехол для одежды VETTA, 60х100 см, ПВХ",237
"VETTA Пленка на стекло статическая в рулоне ""Сияние"", 2 дизайна 3D, 45х200см, ПВХ",224
"VETTA Насадка для швабры с распылителем на липучках, микрофибра 41x13см",195
"VETTA Салфетки универсальные 50 шт.в рулоне, 20x25 см., спанлейс",195
"Пробка для ванной, d4,5см, ""Морской обитатель""",167
"BY Щётка для посуды, полипропилен",167
"VETTA Вешалка настенная ""Плетенка"", металл, 4 крючка, 33х16х5см",159
"VETTA Шпажки-шампуры 90шт, бамбук, 30см, d3мм",139
"VETTA Стакан с разделителем для зубных щеток и пасты, пластик, 7,5х7,5х11,7см, 2 цвета",125
"Набор губок для мытья посуды Americano, 5 шт, 9,5x6,5x3,6см, Perfect House",125
"FORZA Набор трубок термоусадочных 2/1, 3/1,5, 4/2, 6/3, С,К,Ч,Б, 20шт х 8см, полиэтилен",111
"Безмен механический, нагрузка до 10 кг, цвет микс",111
"Салфетка для сухой уборки из микрофибры Vetta, 30х40 см, цвет микс",111
"VETTA Веревка капроновая, 20м x 3мм, 5 цветов",102
"Пакеты для запекания с клипсами 4 шт, 30x40 см, VETTA",77
"Крючки самоклеящиеся в ванную 2 шт, ВЕСЕЛЫЙ РОДЖЕР WF-313",77
"Воск для обуви, банка 45мл, бесцветный, Эффектон, 2587618",63
"VETTA Шапочка для душа, полиэстер, 4 цвета",53
ФУКС Губка силиконовая для блеска,22
"АКВАФОР Фильтр-кувшин 3,9л, Гарри, модель P42А5N, красный",399799
"VETTA Зеркало настенное двухстороннее поворотное на складном кронштейне, 17см",1330
"VETTA Коврик для ванной, шенилл с люрексом, 40х60, микрофибра, 2 цвета",1049
"Удлинитель 4 гнезда FORZA 1,5 кв.мм 3 м, с заземлением, выключателем, евро, 16A,3500Вт",909
"VETTA Дозатор для жидкого мыла ""Ла Рош"", керамика, металл, 2 дизайна",769
"VETTA Коврик придверный, ворсовый с резиновой каймой, 50x80см, 3 дизайна",741
"Комплект чехлов для сиденья и на крышку унитаза, на липучке, искусственный мех, ПВХ, 44х38см, 4 цвет",657
"VETTA Коврик придверный, резиновый с ворсом полиэстер, 45х75см, CR004",629
"VETTA Флоренция Корзина с веревочными ручками, текстиль, 25х20х15см, 3 цвета",601
"VETTA Коврик придверный, иглопробивной, 40х60см, 500г/м2, 3 цвета",447
